[
    {
        "slug": "vela-exchange",
        "name": "Vela Exchange",
        "website": "https://vela.exchange",
        "description": "Trade with up to 250x leverage across crypto, forex, metals and more",
        "tags": [
            "perpetual futures",
            "forex"
        ],
        "chains": [
            "Arbitrum One"
        ],
        "docs": "https://docs.vela.exchange/vela-knowledge-base/exchange/platform-overview",
        "twitter": "https://twitter.com/vela_exchange",
        "telegram": "https://t.me/vela_exchange",
        "discord": "https://discord.com/invite/velaexchange",
        "maxLeverage": 250,
        "leverageInfo": "https://www.vela.exchange/whitepaper.pdf"
    },
    {
        "slug": "gmx-v1",
        "name": "GMX",
        "website": "https://gmx.io/",
        "description": "Trade BTC, ETH, AVAX and other with up to 50x leverage from your wallet",
        "tags": [
            "perpetual futures"
        ],
        "chains": [
            "Arbitrum One",
            "Avalanche"
        ],
        "docs": "https://docs.gmx.io/",
        "twitter": "https://twitter.com/GMX_IO",
        "telegram": "https://t.me/GMX_IO",
        "discord": "https://discord.com/invite/ymN38YefH9",
        "github": "https://github.com/gmx-io",
        "maxLeverage": 50,
        "leverageInfo": "https://docs.gmx.io/docs/trading/v2"
    },
    {
        "slug": "dydx",
        "name": "dYdX",
        "website": "https://dydx.exchange/",
        "description": "Trade Perpetual Contracts with low fees, deep liquidity, and up to 20Ã— more Buying Power",
        "tags": [
            "perpetual futures"
        ],
        "chains": [
            "Ethereum"
        ],
        "docs": "https://v4-teacher.vercel.app/",
        "twitter": "https://twitter.com/dydx",
        "discord": "https://discord.com/invite/Tuze6tY",
        "github": "https://github.com/dydxprotocol/",
        "maxLeverage": 20
    },
    {
        "slug": "perpetual-protocol",
        "name": "Perpetual Protocol",
        "website": "https://app.perp.com/",
        "description": "Designed to facilitate the trading of derivatives known as perpetual contracts.",
        "tags": [
            "perpetual futures"
        ],
        "chains": [
            "Optimism"
        ],
        "twitter": "https://twitter.com/perpprotocol",
        "telegram": "https://t.me/perpetualprotocol",
        "discord": "https://discord.com/invite/mYKKRTn",
        "github": "https://github.com/perpetual-protocol",
        "maxLeverage": 10
    },
    {
        "slug": "metavault-derivatives-v2",
        "name": "Metavault Trade",
        "website": "https://metavault.trade/",
        "description": "Decentralized spot & perpetual futures.",
        "tags": [
            "perpetual futures",
            "binary options"
        ],
        "chains": [
            "Polygon"
        ],
        "twitter": "https://www.twitter.com/metavaulttrade/",
        "telegram": "https://t.me/MetavaultTrade/",
        "discord": "https://discord.com/invite/metavault",
        "github": "https://github.com/metavaultorg/",
        "maxLeverage": 50,
        "leverageInfo": "https://docs.metavault.trade/trading-features/perpetual-and-spot-trading/what-is-spot-and-perp-trading#leveraged-instrument"
    },
    {
        "slug": "mcdex",
        "name": "MUX",
        "website": "https://mux.network/",
        "description": "MUX dynamically routes positions to suited underlying trading protocols.",
        "tags": [
            "perpetual futures",
            "aggregator"
        ],
        "chains": [
            "Arbitrum One",
            "Binance Smart Chain",
            "Avalanche",
            "Optimism",
            "Fantom"
        ],
        "twitter": "https://twitter.com/muxprotocol",
        "telegram": "https://t.me/muxprotocol",
        "discord": "https://discord.com/invite/bd88NrzN3N",
        "github": "https://github.com/mux-world/mux-protocol",
        "maxLeverage": 100,
        "leverageInfo": "https://docs.mux.network/protocol/overview/leveraged-trading-protocol"
    },
    {
        "slug": "kwenta",
        "name": "Kwenta",
        "website": "https://kwenta.eth.limo/",
        "description": "Decentralized derivatives trading platform. Gain exposure to a variety of on-chain and real-world assets, and advanced functionality through the Kwenta Smart Margin Wallet.",
        "tags": [
            "perpetual futures",
            "synthetic assets",
            "synthetix ecosystem"
        ],
        "chains": [
            "Optimism"
        ],
        "twitter": "https://twitter.com/kwenta_io",
        "discord": "http://discord.gg/kwentaio",
        "github": "https://github.com/Kwenta",
        "maxLeverage": 50,
        "leverageInfo": "https://docs.kwenta.io/using-kwenta/perpetual-futures/leverage"
    },
    {
        "slug": "apex-protocol",
        "name": "Apex",
        "website": "https://www.apex.exchange/",
        "description": "ApeX Pro is a non-custodial trading platform that delivers limitless cross-margined perpetual contracts to its metacommunity under a new social trading framework",
        "tags": [
            "perpetual futures"
        ],
        "chains": [
            "Ethereum",
            "Binance Smart Chain",
            "Polygon",
            "Arbitrum One",
            "Avalanche",
            "Optimism"
        ],
        "docs": "https://apex-pro.gitbook.io/apex-pro/",
        "twitter": "https://twitter.com/OfficialApeXdex",
        "telegram": "https://t.me/ApeXdex",
        "discord": "https://discord.com/invite/366Puqavwx",
        "github": "https://github.com/ApeX-Protocol"
    },
    {
        "slug": "apx-finance",
        "name": "ApolloX",
        "website": "https://www.apollox.finance/",
        "description": "Trade crypto perpetuals with up to 500x leverage, low fees, and the lowest slippage on the market",
        "tags": [
            "perpetual futures"
        ],
        "chains": [
            "Binance Smart Chain"
        ],
        "twitter": "https://twitter.com/ApolloX_Finance",
        "telegram": "https://t.me/apolloxchange",
        "discord": "https://discord.com/invite/q5eH3zktcm",
        "github": "https://github.com/apollox-finance",
        "maxLeverage": 500,
        "leverageInfo": "https://apollox-finance.gitbook.io/apollox-finance/welcome/trading-on-v1/how-to-start-trading-on-apollox/margin-mode-and-leverage"
    },
    {
        "slug": "mango-markets-v3",
        "name": "Mango Markets",
        "website": "https://mango.markets/",
        "description": "Solana and Serum blockchain-powered platform, all-in-one trading platform for spot markets, derivatives assets, lending and borrowing",
        "tags": [
            "perpetual futures"
        ],
        "chains": [
            "Solana"
        ],
        "twitter": "https://twitter.com/mangomarkets",
        "discord": "https://discord.com/invite/8vs8uJJrcp",
        "github": "https://github.com/blockworks-foundation",
        "maxLeverage": 20,
        "leverageInfo": "https://docs.mango.markets/mango-v3-deprecated/perp-faq#how-much-leverage-can-i-take"
    },
    {
        "slug": "synthetix",
        "name": "Synthetix Ecosystem",
        "website": "https://synthetix.io/",
        "description": "Provides liquidity for permissionless derivatives like perpetual futures, options, parimutuel markets, and more across EVM chains.",
        "tags": [
            "ecosystem",
            "synthetix ecosystem",
            "commodities"
        ],
        "chains": [
            "Ethereum"
        ],
        "twitter": "https://twitter.com/synthetix_io",
        "discord": "https://discord.com/invite/AEdUHzt",
        "github": "https://github.com/synthetixio",
        "leverageInfo": "https://docs.synthetix.io/v/v3/for-developers/smart-contracts#setcollateralleverage"
    },
    {
        "slug": "fulcrom",
        "name": "Fulcrom",
        "website": "https://fulcrom.finance/",
        "description": "Decentralized perpetual futures on Cronos for leverage trading with minimal fees and price impact, and staking",
        "tags": [
            "perpetual futures"
        ],
        "chains": [
            "Cronos"
        ],
        "twitter": "https://twitter.com/FulcromFinance",
        "telegram": "https://t.me/FulcromFinance",
        "discord": "https://discord.com/invite/7cTMWnpAfd",
        "maxLeverage": 75,
        "leverageInfo": "https://docs.fulcrom.finance/fulcrom-finance/core-modules/trading-module#fulcrom-provides-below-trading-features"
    },
    {
        "slug": "vertex-protocol",
        "name": "Vertex Protocol",
        "website": "https://vertexprotocol.com/",
        "description": "Trade, Earn & Borrow. All in One DEX. Turbo-charged trading engine to outperform the competition. Trade on Vertex and earn $VRTX",
        "tags": [
            "perpetual futures"
        ],
        "chains": [
            "Arbitrum One"
        ],
        "twitter": "https://twitter.com/vertex_protocol",
        "discord": "https://discord.com/invite/vertexprotocol",
        "github": "https://github.com/vertex-protocol",
        "maxLeverage": 20,
        "leverageInfo": "https://vertex-protocol.gitbook.io/docs/tutorials/perpetual-trading#step-2-decide-your-trade-leverage"
    },
    {
        "slug": "fxdx",
        "name": "fxdx exchange",
        "website": "https://fxdx.exchange/",
        "description": "Trading in Cryptocurrency Futures with No Fees, Robust Oracle Pricing",
        "tags": [
            "perpetual futures"
        ],
        "chains": [
            "Optimism",
            "Base"
        ],
        "twitter": "https://twitter.com/fxdxdex",
        "telegram": "https://t.me/fxdxdex",
        "discord": "https://discord.com/invite/AdmFvVjfjh",
        "github": "https://github.com/fxdxdex",
        "maxLeverage": 50,